,corpus,cluster,readable
146,рф контролировать юговосточный окраина песок всу держать оборона эксперт iswвражеские попытка продвигаться запад богородичный семнадцать км славянск полностью проваливаться оккупант вероятно иметь частничный успех вблизи бахмут данные аналитик захватить поселок майский семнадцать км город русский пытаться прорвать оборона всу югозапад донецк предел тридцать км граница запорожский область безуспешно гу подписываться,10,"РФ контролирует юго-восточную окраину Песков, но ВСУ держат оборону, – эксперты из ISWВражеские попытки продвинуться в западе Богородичного, в 17 км от Славянска полностью провалились.Оккупанты, вероятно, имеют частничный успех вблизи Бахмута. По данным аналитиков, они захватили поселок Майское, в 17 км от города.Русские пытались прорвать оборону ВСУ на юго-западе от Донецка и в пределах 30 км от границы с Запорожской областью, но безуспешно.ГУ > Подписаться"
147,рашист хотеть отступать херсонаорки заминировать жизненно важный коммуникация среди газоснабжение электроснабжение водоснабжение сообщать представитель гур мо андрей юсов стратегия террор выжигать земля готовиться россиянин контрнаступление украинский сила юг гу подписываться,5,"Рашисты хотят отступать из ХерсонаОрки заминировали жизненно важные коммуникации, среди которых газоснабжение, электроснабжение и водоснабжение, сообщает представитель ГУР МО Андрей Юсов.Это стратегия террора и выжженной земли, к которой готовятся россияне, перед контрнаступлением украинских сил на юге.ГУ > Подписаться"
148,снова угроза северный корея пообещать расплата вашингтон нэнси пелось посещать южный кореюпо мнение глава мид северный корея очередной проявление враждебный политика сша отношение государство гу подписываться,10,"И снова угрозы: Северная Корея пообещала «расплату» Вашингтону за то, что Нэнси Пелоси посетила Южную КореюПо мнению главы МИД Северной Кореи, это очередное проявление враждебной политики США по отношению к другим государствам.ГУ > Подписаться"
149,план ес снижение потребление газ отказываться поддерживать венгрия польша сообщать reuters ссылка документыоднако несогласие повлиять принятие план нуждаться поддержка сторона большинство пятнадцать страна ес гу подписываться,8,"❗️План ЕС по снижению потребления газа на 15% отказались поддержать Венгрия и Польша, сообщает Reuters со ссылкой на документыОднако, их несогласие не повлияло на принятие плана, который нуждался в поддержке со стороны большинства из 15 стран ЕС.ГУ > Подписаться"
150,сохраняться угроза ракетный удар весь территория украиныоб сообщать генштаб всу акватория черный море корабельный группировка противник продолжать выполнять определенный задача сохраняться угроза ракетный удар весь территория украина готовность применение высокоточный оружие находиться четыре носитель крылатый ракета морской базирование говориться сообщение гу подписываться,5,"Сохраняется угроза ракетных ударов по всей территории УкраиныОб этом сообщает Генштаб ВСУ.""В акватории Черного моря корабельная группировка противника продолжает выполнять определенные задачи. Сохраняется угроза ракетных ударов по всей территории Украины. В готовности к применению высокоточного оружия находятся четыре носители крылатых ракет морского базирования"", - говорится в сообщении.ГУ > Подписаться"
151,белый дом готовиться предоставлять украина новый пакет военный помощь размер млрд reuters данные агентство сша передавать боеприпасы бронировать медицинский транспорт гу подписываться,5,"Белый дом готовится предоставить Украине новый пакет военной помощи размером $1 млрд, — Reuters По данным агентства, США передадут боеприпасы и бронированный медицинский транспорт.ГУ > Подписаться"
152,армия израиль начинать широкомасштабный воздушный операция против исламский джихад сектор газа сообщать минобороны страна наш политика однозначный угрожать уничтожать заявлять глава ведомство бени ганца гу подписываться,3,"Армия Израиля начинает широкомасштабную воздушную операцию против «Исламского джихада» в Секторе Газа, сообщают в Минобороны страны«Наша политика однозначна – тот, кто нам угрожает, будет уничтожен», – заявил глава ведомства Бени Ганц.ГУ > Подписаться"
153,очень жесткий кадр уничтожение наблюдательный пост хамас сектор газа рамка операция рассвет армия израилегать подписываться,9,"Очень жесткие кадры уничтожения наблюдательных постов ХАМАС в Секторе Газа в рамках операции ""Рассвет"" от армии ИзраиляГУ > Подписаться"
154,рашист второй день обстреливать запорожский аэс сообщать энергоатоморка серьезно повреждать азотный кислородный станция объединять вспомогательный корпус иметься риск утечка водород распыление радиоактивный вещество высокий пожарный опасность гу подписываться,8,"Рашисты второй раз за день обстреляли Запорожскую АЭС, — об этом сообщает ЭнергоатомОрки серьезно повредили азотно-кислородную станцию и объединенный вспомогательный корпус. Имеются риски утечки водорода и распыления радиоактивных веществ. Высока пожарная опасность.ГУ > Подписаться"
155,сбу запускать онлайн сервис поиск военнопленный пропадать вестисообщать обстоятельство исчезновение человек онлайн форма отправлять данные конфиденциальный заверять спецслужба гу подписываться,10,"СБУ запустила онлайн-сервис по поиску военнопленных и пропавших без вестиСообщить об обстоятельствах исчезновения человека можно через онлайн-форму. Отправленные данные конфиденциальны, заверяют в спецслужбе.ГУ > Подписаться"
156,запорожская аэс поддаваться удар сторона российский войско сообщать энергоатом иметься информация зафиксировать прилет возле промышленный площадка заэсг подписываться,0,"❗️Запорожская АЭС поддалась ударам со стороны российских войск, сообщает «Энергоатом». По имеющейся информации, зафиксировано три «прилета» возле промышленной площадки ЗАЭСГУ > Подписаться"
157,уважаемый украинец просьба занимать надобность трамвай близкий времяпо льгота поехать ракета himars вместе кукуха российский пропагандон гу подписываться,5,"Уважаемые украинцы, просьба не занимать без надобности трамваи в ближайшее времяПо льготе поедут ракеты для HIMARS. Вместе с кукухой российских пропагандонов.ГУ > Подписаться"
158,китай приостанавливать сотрудничество сша борьба наркотик сми ссылка мид кнрга подписываться,7,"Китай приостанавливает сотрудничество с США по борьбе с наркотиками, — СМИ со ссылкой на МИД КНРГУ > Подписаться"
159,ес вводить санкция против янукович сын живгу подписываться,1,ЕС ввел санкции против Януковича и его сына. Он еще живГУ > Подписаться
160,сша откладывать испытание ракета minuteman iii напряженность вокруг тайвань сообщать the world street journalпредставитель пентагон заявлять министр оборона ллойд остин отдавать приказ отсрочка избегать дальнейший обострение отношение китай поскольку китайский военный участвовать демонстрация сила вблизи тайвань гу подписываться,2,"США отложили испытание ракеты Minuteman III из-за напряженности вокруг Тайваня, сообщает The World Street JournalПредставитель Пентагона заявил, что министр обороны Ллойд Остин отдал приказ об отсрочке, чтобы избежать дальнейшего обострения отношений с Китаем, поскольку китайские военные участвуют в демонстрации силы вблизи Тайваня.ГУ > Подписаться"
161,северная корея выходить договор нераспространение ядерный оружие законный основание иметь право самооборона сообщать сми ссылка заявление постпредство кндр оонмир катиться пропасть гу подписываться,10,"❗️Северная Корея вышла из Договора о нераспространении ядерного оружия на законных основаниях и имеет право на самооборону, — об этом сообщают СМИ со ссылкой на заявление постпредства КНДР при ООНМир катится в пропасть.ГУ > Подписаться"
162,космический страсть новый российский спутник шпион космос запускать слежка американский спутник usa такое предположение высказывать нидерландский специалист спутниковый отслеживание марко лангбрук сообщать space com гу подписываться,0,"Космические страсти: новый российский спутник-шпион ""Космос 2558"" запустили для слежки за американским спутником USA 326Такое предположение высказал нидерландский специалист по спутниковому отслеживанию Марко Лангбрук, сообщает Space.com.ГУ > Подписаться"
163,запорожский аэс захватить рашист полностью выходить изпод контроль организация сообщать магатэ весь принцип ядерный безопасность нарушать карта поставлять чрезвычайно серьезный опасный дело специалист магатэ необходимо отправляться запорожье предотвращение ядерный авария гу подписываться,10,"Запорожская АЭС, которую захватили рашисты, полностью вышла из-под контроля организации, – об этом сообщило МАГАТЭ«Все принципы ядерной безопасности были нарушены. На карту поставлено чрезвычайно серьезное и опасное дело. Специалистам МАГАТЭ необходимо отправиться в Запорожье для предотвращения ядерной аварии».ГУ > Подписаться"
164,блинкен глава мид кнр ход встреча g прошлый месяц обсуждать возможный визит пелось тайвань сми ссылка представитель госдепартаментага подписываться,4,"❗️Блинкен и глава МИД КНР в ходе встречи G20 ещё в прошлом месяце обсуждали возможный визит Пелоси на Тайвань, — СМИ со ссылкой на представителя ГосдепартаментаГУ > Подписаться"
165,сегодня нэнси пелось встречаться главый тайваньский администрация цай инвэнь сегодня наш делегация очень гордиться прибывать тайвань давать понимать отказываться наш приверженность тайвань гордиться наш дружба прошедший испытание время заявлять спикер палата представитель конгресс сша свой очередь цай инвэнь отмечать тайвань отступать лицо военный угроза укреплять свой обороноспособность гу подписываться,4,"Сегодня Нэнси Пелоси встретилась с с главой тайваньской администрации Цай Инвэнь""Сегодня наша делегация, чем я очень горжусь, прибыла на Тайвань, чтобы дать понять, что мы не откажемся от нашей приверженности Тайваню и мы гордимся нашей дружбой, прошедшей испытание временем"", — заявила спикер Палаты представителей Конгресса США.В свою очередь Цай Инвэнь отметила, что Тайвань не отступит перед лицом военных угроз и будет укреплять свою обороноспособность.ГУ > Подписаться"
166,байден уважать решение пелось поехать тайвань белый домпрезидент сша уточнять пойти поездка спикер палата представитель тайвань польза интерес штат время сша хотеть создавать кризис отношение кнр намерен бряцать оружие поддерживать независимость тайвань гу подписываться,4,"Байден уважает решение Пелоси поехать на Тайвань, — Белый ДомПрезидент США не уточнил, пойдёт ли поездка спикера Палаты представителей на Тайвань на пользу интересам Штатов.В то же время США не хотят создавать кризис в отношениях с КНР, не намерены «бряцать оружием» и не поддерживают независимость Тайваня.ГУ > Подписаться"
167,комитет сенат сша международный отношение собираться август рассмотрение законопроект политика отношение тайвань писать defense newsгу подписываться,4,"Комитет Сената США по международным отношениям соберется 3 августа для рассмотрения законопроекта о политике в отношении Тайваня, — об этом пишет Defense NewsГУ > Подписаться"
168,восточное военный командование кнр заявлять начало учение вокруг тайвань сегодня вечер проводить совместный военный операция вокруг остров тайвань август местный время говориться заявление командование гу подписываться,2,"❗️Восточное военное командование КНР заявило о начала учений вокруг Тайваня уже сегодня вечером«Мы будем проводить совместные военные операции вокруг острова Тайвань со 2 августа по местному времени», - говорится в заявлении командования.ГУ > Подписаться"
169,возможный словесный ответ китай визит пелосиармия китай четыре семь август проводить учение шесть район вокруг остров тайвань сообщать агентство синьхуа район учение карта гу подписываться,2,А вот и возможный не словесный ответ Китая на визит ПелосиАрмия Китая с 4 по 7 августа проведет учения в шести районах вокруг острова Тайвань.Об этом сообщает агентство Синьхуа. Районы учений – на карте.ГУ > Подписаться
170,китайские истребитель су пересекать тайваньский пролив лететь сторона тайвань сообщать канал cgtnгу подписываться,2,"❗️Китайские истребители Су-35 пересекают Тайваньский пролив, летят в сторону Тайваня — об этом сообщает канал CGTNГУ > Подписаться"
171,тайваньский аэропорт суншань предположительный прибывать спикер палата представитель конгресс сша нэнси пелось снимать маскировочный чехол зенитный пушка сообщать сми гу подписываться,4,"❗️Тайваньский аэропорт ""Суншань"", куда предположительное прибудет спикер Палаты представителей Конгресса США Нэнси Пелоси, снял маскировочные чехлы с зенитных пушек, — об этом сообщают СМИ ГУ > Подписаться"
172,китайскую межконтинентальный ракета dfb кудато везутdfb иметь предполагаемый дальность километр мочь нести водородный боеголовка гу подписываться,2,⚡️⚡️Китайскую межконтинентальную ракету DF5b куда-то везутDF5b имеет предполагаемую дальность 12.000-15.000 километров и может нести 3-8 водородных боеголовок.ГУ > Подписаться
173,китайские военный самолет пролететь линия разделять тайваньский пролив reutersгу подписываться,2,"⚡️Китайские военные самолеты пролетели над линией, разделяющей Тайваньский пролив, — ReutersГУ > Подписаться"
174,самолет нэнси пелосить борт резко повертывать сторона тайванять время сайт администрация президент тайвань подвергаться кибератака открываться обстановка накаляться гу подписываться,4,"Самолет с Нэнси Пелоси на борту резко повернул в сторону ТайваняВ то же время, сайт администрации президента Тайваня подвергся кибератаке. Сейчас он не открывается.Обстановка накаляется.ГУ > Подписаться"
175,самолет нэнси пелось следить онлайн двести шестьдесят тысяча человек число каждый минута растеткак следовать данные сервис flightradar данный момент спецборт ввс сша спикер палата представитель сша вылетать куалалумпур направляться сторона индонезия гу подписываться,4,"За самолетом Нэнси Пелоси следят онлайн уже 262 тысячи человек — их число с каждой минутой растетКак следует из данных сервиса «Flightradar», в данный момент спецборт ВВС США со Спикером палаты представителей США вылетел из Куала-Лумпура и направляется в сторону Индонезии.ГУ > Подписаться"
176,в провинция фуцзянь видеть китайский баллистический ракета df как писать сми дальность полет ноль км гу подписываться,2,"❗️В провинции Фуцзянь видели китайские баллистические ракеты DF-16Как пишут СМИ, дальность ее полета — 1 000 км.ГУ > Подписаться"
