,corpus,cluster,readable
177,китайские истребитель подымать находиться пролив тайвань китай писать reutersгу подписываться,2,❗️Китайские истребители подняты и находятся в проливе между Тайванем и Китаем — об этом пишет ReutersГУ > Подписаться
178,видео кадр военный учение китай проходить провинция фуцзянь вблизи тайвань сегодня ожидать спикер нижний палата конгресс сша нэнси пелосиг подписываться,2,"На видео — кадры военных учений Китая, которые проходят в провинции Фуцзянь вблизи Тайваня, где сегодня ожидают спикера нижней палаты Конгресса США Нэнси ПелосиГУ > Подписаться"
179,сша собираться одобрять новый пакет помощь украина пятьсот пятьдесят миллион доллар сфера оборона заявлять белый домв должный входить снаряд рсзо himars боеприпасы артиллерийский орудие калибр сто пятьдесят пять мм гу подписываться,5,"❗️США собираются одобрить новый пакет помощи Украине на 550 миллионов долларов в сфере обороны, заявил Белый домВ него должны войти снаряды для РСЗО HIMARS и боеприпасы для артиллерийских орудий калибра 155 мм.ГУ > Подписаться"
180,макрон называть обстрел еленовка погибать украинский военнопленный бойня совершать российский вооруженный сила выражать поддержка украинский народ сопротивление елисейский дворец телефонный разговор макрон зеленскогога подписываться,5,"Макрон назвал обстрел Еленовки, где погибли украинские военнопленные, ""бойней, совершённой российскими вооруженными силами"" и выразил поддержку украинскому народу и его сопротивлению, — Елисейский дворец о телефонном разговоре Макрона и ЗеленскогоГУ > Подписаться"
181,президент владимир зеленский проводить телефонный разговор лидер франция эммануэль макрономкак сообщаться сайт офис президент переговоры продолжаться полтора час зеленский проинформировать французский коллега ход противодействие российский агрессия ситуация поле бой также сторона обсуждать сотрудничество сфера безопасность поставка оружие украина гу подписываться,5,"❗Президент Владимир Зеленский провел телефонный разговор с лидером Франции Эммануэлем МакрономКак сообщается на сайте Офиса Президента, переговоры продолжались полтора часа.Зеленский проинформировал французского коллегу о ходе противодействия российской агрессии и ситуации на поле боя, а также стороны обсудили сотрудничество в сфере безопасности и поставки оружия Украине.ГУ > Подписаться"
182,власть евросоюз запрещать закупка уголь россиисоответствовать эмбарго вступать сила понедельник август мера предусматривать пятый пакет санкция против рф утверждать апрель тысяча двадцать год сообщать прессслужба европейский комиссия принятие пятый пакет санкция страна европейский союз ежегодно покупать предприятие российский федерация уголь восемь млрд доллар гу подписываться,10,"Власти Евросоюза запретили закупку угля из РоссииСоответствующее эмбарго вступило в силу с понедельника, 1 августа. Такую меру предусматривает пятый пакет санкций против РФ - его утвердили в апреле 2022 года, сообщает  пресс-служба Европейской комиссии.До принятия пятого пакета санкций страны Европейского союза ежегодно покупали у предприятий из Российской Федерации угля на 8 млрд долларов. ГУ > Подписаться"
183,первое судно зерно покидать порт одесса сообщать сппгу подписываться,1,❗️Первое судно с зерном покинуло порт Одессы — об этом сообщает CNNГУ > Подписаться
184,первый начало российский полномасштабный вторжение украина судно зерно выходить порт черный море август гу подписываться,5,Первое с начала российского полномасштабного вторжения в Украину судно с зерном выйдет из порта в Черном море 1 августа в 8:30ГУ > Подписаться
185,ермак салливан поговорить усиление вооружение весь ждать поставка пво,1,#Ермак и Салливан поговорили об усилении вооружения. Все мы ждем поставок ПВО.
186,байден висловлював своє захопленний лідерством зеленський воєнний час і має твердие намир продовжуватить підтримувати україну це заявлять координатор з комунікацій раді нацбезпек сша джон кірбі коментуюч статть the new york times де йдеться що між білим дом зеленський існує глибок недовіра,5,"🇺🇸🇺🇦 Байден висловлював своє захоплення лідерством Зеленського у воєнний час і має твердий намір продовжувати підтримувати Україну.Про це заявив координатор з комунікацій у Раді нацбезпеки США Джон Кірбі, коментуючи статтю The New York Times, де йдеться, що ""Між Білим домом та Зеленським існує глибока недовіра"""
187,пелось утирать нос си вряд скоро оклематься,1,"#Пелоси только что утерла нос Си, да так, что он вряд ли скоро оклемается."
188,зеленский макрон обсуждать помощь вооружение франция,1,#Зеленский и Макрон обсудили помощь вооружениями от Франции.
189,британский газета the times проводить собственный расследование связывать госпитализация чубайс приходить вывод мочь отравлять антивоенный настроение пример приводить сергей скрипаль становиться жертва инакомыслие высокопоставленный кремлевский чиновник уходить отставка знак протест против срочно доставлять реанимация побуждать сотрудник разведка расследовать отравлять крайний мера европейский разведывательный агентство изучать обстоятельство болезнь чубайс фон предположение возможно последний инакомыслящий становиться жертва внесудебный отравление число сергей скрипаль писать издание эбаутраша,10,"Британская газета The Times провела собственное расследование, связанное с госпитализацией Чубайса и пришла к выводу, что его могли отравить за антивоенные настроения. В пример приводят Сергея Скрипаля, который стал жертвой за инакомыслие. «Высокопоставленный кремлевский чиновник, ушедший в отставку в знак протеста против в****, был срочно доставлен в реанимацию, что побудило сотрудников разведки расследовать, был ли он отравлен. По крайней мере одно европейское разведывательное агентство изучало обстоятельства болезни Чубайса на фоне предположений о том, что он, возможно, был последним инакомыслящим, ставшим жертвой внесудебных отравлений, в том числе Сергея Скрипаля», — пишет издание.#эбаутраша"
190,шумок ото день разливаться синева агитатор контрактный служба разворачивать мобильный военкомат место скопление человек пермь смекать день вдв уравнение бухий десантник возможность проявлять свой отвага поле бой сумма давать пополнение ряд отправляться украина гений маркетинг,5,"Под шумок ото дня разлившейся синевы, агитаторы на контрактную службу разворачивают мобильные военкоматы в местах скопления людей. В Перми смекнули, что в День ВДВ уравнение из бухих десантников и возможности проявить свою отвагу на поле боя в сумме дает пополнение в рядах тех, кто отправляется на Украину.Гении маркетинга."
191,сша сталинист сходка часть открытие филиал организация центр политический инновация выходить флаг китай днр z гимн сша,7,"В США сталинисты на сходке в часть открытия филиала организации «центр политических инноваций» вышли с флагами Китая, ДНР и Z под гимн США."
192,российский сми переживать высокий цена энергоноситель немецкий пенсионер приходиться зимовать средиземноморский курорт,0,"Российские СМИ переживают, что из-за высоких цен на энергоносители немецким пенсионерам приходится зимовать на средиземноморских курортах."
193,китай сгорать старый мир деревянный мост летний пиннань ваньань город ниндэ пожар начинаться вечер шесть август момент огонь потушить национальный китайский реликвия ничто оставаться,8,"В Китае сгорел старейший в мире деревянный мост – 900-летний Пиннань Ваньань в городе Ниндэ. Пожар начался вечером 6 августа. К моменту, когда огонь был потушен, от национальной китайской реликвии ничего не осталось."
194,американский баскетболистка бриттня грайнер российский суд давать девять год колония контрабанда наркотик вместе приговаривать шпионаж американец пол уилан мочь обменять сидеть сша россиянин писать сми частность сидеть американский тюрьма оружейный барон виктор бут байден называть приговор неприемлемый пообещать сделать возможный вернуть грайнер уилан домой,0,"Американской баскетболистке Бриттни Грайнер российский суд дал девять лет колонии за контрабанду наркотиков. Её вместе с ещё одним приговорённым за шпионаж американцем Полом Уиланом могут обменять на сидящих в США россиян, писали СМИ. В частности — на сидящего в американской тюрьме «оружейного барона» Виктора Бута.Байден уже назвал приговор неприемлемым и пообещал сделать всё возможное, чтобы вернуть Грайнер и Уилана домой"
195,человек погибать пожар склад ozon тринадцать пострадать писать риа новость ссылка экстренный служба поджог рассматриваться основной версия причина пожар,8,"1 человек погиб при пожаре на складе Ozon, еще 13 пострадали, пишут РИА Новости со ссылкой на экстренные службы. Поджог рассматривается как основная версия причины пожара."
196,система himars настолько пугать российский военный украина отбивать желание воевать далеко минобороны россия вынуждать регулярно врать уничтожение хаймарс заставлять врать т н военкор подымать боевой дух войско деморализация россиянин сообщать аналитик институт исследование война isw украинский военный заявлять himars россиянин уничтожать удаваться никакой убедительный доказательство обратный кроме весьма сомнительный видео российский минобороны представлять,5,"Системы HIMARS настолько пугают российских военных в Украине и отбивают у них желание воевать дальше, что Минобороны России вынуждено регулярно врать об уничтожении «хаймарсов» и заставлять врать про то же т.н. «военкоров», чтобы поднять боевой дух войск.О деморализации россиян сообщают аналитики Института исследования войны (ISW). Украинские же военные заявляют, что ни одного HIMARS россиянам уничтожить так и не удалось — тем более что никаких убедительных доказательств обратного, кроме весьма сомнительных видео, российское Минобороны так ни разу и не представило"
197,армия китай заявлять проведение четыре семь август военный учение шесть район вокруг тайвань,2,Армия Китая заявила о проведении с 4 по 7 августа военных учений в шести районах вокруг Тайваня.
198,сообщение минобороны ра август скоропостижный скончаться военнослужащий контрактник n й воинский часть рядовой аршалуйс врамович ованнисян г р установление причина смерть назначать судебномедицинский,10,"⚡️Сообщение Минобороны РА:7 августа скоропостижно скончался военнослужащий-контрактник N-й воинской части, рядовой Аршалуйс Врамович Ованнисян (1976 г.р.). Для установления причины смерти назначена судебно-медицинская экспертиза.@bagramyan26"
199,азербайджан должный понести ответственность очередной нарушение соглашение прекращение огонь армения призывать госдеп использовать весь свой дипломатический инструмент привлекать режим алиев ответственность нападение арцах предотвращать будущий злодеяние член палата представитель сша ян,10,"❗️«Азербайджан должен понести ответственность за очередное нарушение соглашения о прекращении огня с Арменией. Я призываю Госдеп использовать все свои дипломатические инструменты, чтобы привлечь режим Алиева к ответственности за его нападения на Арцах и предотвратить будущие злодеяния»: Член Палаты представителей США Ян Шаковски@bagramyan26"
200,президент россия турция прибыль сочи скоро начинаться переговоры лидер страна ожидаться обсуждение становиться проблема нагорный карабах частность последний эскалация подписываться канал,6,"Президенты России и Турции прибыли в Сочи, где скоро начнутся переговоры между лидерами стран.  Ожидается, что одной из тем обсуждения станет проблема Нагорного Карабаха, в частности, последняя эскалация. @KarabakhRecords → подписаться на канал"
201,глубоко обеспокоить безопасность жить нагорный карабах вокруг сообщение возобновление боевой действие район хотеть возврат широкомасштабный боевой действие тысяча двадцать год призывать принимать немедленный мера снижение напряженность недопущение дальнейший эскалация постпред сша обсе посол майкл,10,"«Глубоко обеспокоен безопасностью тех, кто живет в Нагорном Карабахе и вокруг него из-за сообщений о возобновлении боевых действий в этом районе. Мы не хотим возврата к широкомасштабным боевым действиям, как это было в 2020 году, и призываем принять немедленные меры по снижению напряженности и недопущению дальнейшей эскалации»: Постпред США при ОБСЕ, посол  Майкл Карпентер@bagramyan26"
202,глубоко обеспокоить сообщение возобновление насилие нагорный карабах особенно гибель человек предосудительный публикация минобороны азербайджан кадр свой авиаудар гордиться сенатор сша джек,1,"«Глубоко обеспокоен сообщениями о возобновлении насилия в Нагорном Карабахе, особенно о гибели людей. Предосудительны публикации Минобороны Азербайджана кадров своего авиаудара, как будто этим можно гордиться»: Сенатор США Джек Рид@bagramyan26"
203,видеть конкретный предложение премьерминистр армения хотеть вносить обсуждение контекст российский миротворческий операция нагорный карабах мочь гадать любой сторона договоренность достигать президент россия азербайджан премьерминистр армения вправе предлагать дополнительный инициатива пока видеть глава мид рф сергей лавров прессконференция пномпененапоминать четыре август ход заседание правительство премьерминистр армения никола пашинян отмечать происходить событие вызывать общество вопрос связывать миротворческий миссия нагорный,6,"«Мы не видели конкретных предложений, которые премьер-министр Армении хочет внести для обсуждения в контексте российской миротворческой операции в Нагорном Карабахе, я не могу сейчас гадать. Любая из сторон договоренностей, которые были достигнуты президентами России, Азербайджана и премьер-министром Армении, конечно же, вправе предлагать дополнительные инициативы. Пока мы их не видели»: глава МИД РФ Сергей Лавров на пресс-конференции в ПномпенеНапомним, что 4 августа в ходе заседания правительства премьер-министр Армении Никол Пашинян отметил, что происходящие события вызывают у общества вопросы связанные с миротворческой миссией в Нагорном Карабахе@bagramyan26"
