,corpus,cluster,readable
73,авианосный ударный группа вмс сша глава авианосец рональд рейган направляться акватория юговосток тайвань сообщать китайский аналитический центр scspi данные тридцать июль авианосный ударный группа вмс сша покидать южнокитайский море пролив сан бернардино выходить филиппинский море авианосец рональд рейган огибать юговосток филиппинский остров лусон взять курс север сторона тайвань,2,"Авианосная ударная группа ВМС США во главе с авианосцем ""Рональд Рейган"" направилась в акваторию к юго-востоку от Тайваня, сообщил китайский аналитический центр SCSPI. По его данным, 30 июля авианосная ударная группа ВМС США покинула Южно-Китайское море и через пролив Сан-Бернардино вышла в Филиппинское море. После этого авианосец ""Рональд Рейган"" обогнул с юго-востока филиппинский остров Лусон и взял курс на север в сторону Тайваня."
74,центр петербург пьяный россиянин нападывать темнокожий мужчина слово убивать наш солдат подумать американец оказываться сорок летний мужчина приезжать африка слово очевидица происходить нападать ударять африканец лицо потерять сознание упасть тротуар прохожий вызывать скорый помощь мужчина поступать больница закрытый черепномозговой травма сотрясение головной мозг вывих правый плечо,5,"В центре Петербурга три пьяных россиянина напали на темнокожего мужчину со словами ""Такие, как ты, убивают наших солдат!""Они подумали, что он американец. Оказалось, что 43 летний мужчина приехал из Африки.По словам очевидицы происходящего, один из нападавших ударил африканца по лицу, тот потерял сознание и упал на тротуар. Прохожие вызвали скорую помощь. Мужчина поступил в больницу с закрытой черепно-мозговой травмой, сотрясением головного мозга и вывихом правого плеча."
75,япония происходить утечка семь тонна радиоактивный вода внутри энергоблок аэс михама компания оператор станция утверждать ситуация контроль влияние окружающий среда,8,"В Японии произошла утечка семи тонн радиоактивной воды внутри энергоблока на АЭС ""Михама"".Компания-оператор станции утверждает, что ситуация под контролем и влияния на окружающую среду нет"
76,спикер палата представитель конгресс сша нэнси пелось выступать законодательный юань парламент тайваняпо слово прибывать китайский республика имя мир регион глава администрация тайвань цай инвэнь вручать пелось орден благожелательный облако заслуга продвижение отношение вашингтон тайбэй,4,"Спикер Палаты представителей конгресса США Нэнси Пелоси выступила в Законодательном юане (парламенте) ТайваняПо ее словам, она прибыла в Китайскую республику ""во имя мира для региона"". Глава администрации Тайваня Цай Инвэнь вручила Пелоси орден Благожелательных облаков за заслуги в продвижении отношений Вашингтона и Тайбэя."
77,россиянин беларус разрешать сдавать международный экзамен английский язык toefl четыре август удаленный формат,0,Россиянам и беларусам разрешат сдавать международный экзамен по английскому языку TOEFL с 4 августа в удаленном формате
78,байден уважать решение пелось поехать тайвань заявлять белый дом ответ вопрос поддерживать президент сша шаг спикер палата представитель,4,"Байден уважает решение Пелоси поехать на Тайвань, заявили в Белом доме в ответ на вопрос, поддерживает ли президент США шаги спикера Палаты представителей."
79,сша поддерживать независимость тайвань вашингтон сообщать китайский власть высокий уровень заявлять координатор стратегический коммуникация совет национальный безопасность белый дом джон кирби,7,"США не поддерживают независимость Тайваня, об этом Вашингтон сообщал китайским властям на высшем уровне, заявил координатор по стратегическим коммуникациям в Совете национальной безопасности Белого дома Джон Кирби."
80,китай намеривать применять ядерный оружие первый глава департамент мид кнр,7,Китай не намерен применять ядерное оружие первым — глава департамента МИД КНР
81,сша хотеть кризис отношение кнр намерен бряцать оружие сохранять канал общение открытый белый дом,1,"США не хотят кризиса в отношениях с КНР и не намерены ""бряцать оружием"", будут сохранять каналы общения открытыми — Белый дом"
82,председатель кнр си цзиньпина высказываться визит нэнси пелосить тайвань визит пелось тайвань являться демонстрация нецивилизованный кампания империалист продолжать смотреть мир широко раскрытый глаз пропускать провокация сторона американский реакционер говориться заявление председатель кнр,4,"Председатель КНР Си Цзиньпин высказался о визите Нэнси Пелоси на Тайвань""Визит Пелоси на Тайвань является еще одной демонстрацией нецивилизованной кампании империалистов. Мы продолжаем смотреть на мир широко раскрытыми глазами, чтобы не пропустить ни одной провокации со стороны американских реакционеров"", - говорится в заявлении председателя КНР."
83,мид китай вызывать посол сша выражать протест визит нэнси пелосить тайвань,7,МИД Китая вызвал посла США и выразил ему протест из-за визита Нэнси Пелоси на Тайвань
84,оон придерживаться политика китай офис генсек визит пелось тайвань,7,"ООН придерживается политики ""одного Китая"" — офис генсека о визите Пелоси на Тайвань"
85,сша вводить визовый санкция отношение восемьсот девяносто российский официальный лицо включая член совет федерация военный также против тридцать официальный лицо третий страна поддержка присоединение крым,0,"США вводят визовые санкции в отношении 893 российских официальных лиц, включая членов Совета Федерации и военных, а также против 31 официальных лиц третьих стран за поддержку присоединения Крыма"
86,ответ китай мощный сильный посол кнр сша визит пелось,7,Ответ Китая будет мощным и сильным — посол КНР в США о визите Пелоси
87,сша вводить санкция против алина кабаева,1,США ввели санкции против Алины Кабаевой
88,заявление восточный военный командование кнр собираться проводить совместный морской воздушный учение воздушный пространство север югозапад юговосток остров тайвань проводить боевой стрельба большой дальность тайваньский пролив военный операция нацеливать недавний действие сша тайваньский вопрос кнр также проводить боевой стрельба вода восточный побережье остров тайвань,2,"Заявление восточного военного командования КНР: ""Мы собираемся провести совместные морские и воздушные учения в воздушном пространстве к северу, юго-западу и юго-востоку от острова Тайвань. Мы проведем боевые стрельбы с большой дальности в Тайваньском проливе, эти военные операции нацелены на недавние действия США по тайваньскому вопросу. КНР также проведет боевые стрельбы в водах у восточного побережья острова Тайвань""."
89,сила находиться состояние повышать готовность начинаться целенаправленный военный операция противодействие визит пелось тайвань reuters ссылка министерство оборона кнр,2,"Силы находятся в состоянии повышенной готовности, начнутся целенаправленные военные операции по противодействию визиту Пелоси на Тайвань — Reuters со ссылкой на Министерство обороны КНР"
90,министерство оборона тайвань сообщение китайский истребитель су пересекать тайваньский пролив являться ложный,2,"Министерство обороны Тайваня: сообщения о том, что китайские истребители Су-35 пересекли Тайваньский пролив, являются ложными"
91,визит пелось полностью соответствовать политика сша отношение китай причина эскалация сторона китай заявлять белый дом,7,"Визит Пелоси полностью соответствует политике США по отношению к Китаю, причин для эскалации со стороны Китая нет, заявили в Белом Доме."
92,прибытие нэнси пелосить тайвань устанавливать высокий ставка противостояние китай the new york times,2,"Прибытием Нэнси Пелоси на Тайвань она устанавливает высокие ставки на противостояния с Китаем, — The New York Times."
93,пелось ожидаться встречаться президент тайвань среда вылетать тайвань второй половина день центральный информационный агентство тайвань,4,"Пелоси, как ожидается, встретится с президентом Тайваня в среду, вылетит из Тайваня во второй половине дня — центральное информационное агентство Тайваня"
94,пелось заявлять сша мочь оставаться сторона пока китай угрожать тайвань демократия принцип,2,"Пелоси заявила, что США не могут оставаться в стороне, пока Китай ""угрожает Тайваню и демократии в принципе"""
95,китай объявлять четверг воскресение военный учение шесть район море вокруг тайвань,2,Китай объявил с четверга по воскресенье военные учения в шести районах моря вокруг Тайваня
96,мид китай ответ визит пелось тайвань принимать весь необходимый мера защита государственный суверенитет территориальный целостность ответственность последствие лежать сша тайбэй,2,"МИД Китая: в ответ на визит Пелоси на Тайвань мы примем все необходимые меры для защиты государственного суверенитета и территориальной целостности, ответственность за последствия будет лежать на США и Тайбэе"
97,нэнси пелось заявлять сша поддерживать тайваньский демократия продолжать выступать против односторонний попытка изменять статускво,4,"Нэнси Пелоси заявила, что США поддерживают тайваньскую демократию и продолжают выступать против односторонних попыток ""изменить статус-кво"""
98,визит пелось тайвань являться серьезный нарушение суверенитет территориальный целостность китай мид кнр,2,Визит Пелоси на Тайвань является серьезным нарушением суверенитета и территориальной целостности Китая — МИД КНР
99,самолет предположительно находиться спикер палата представитель конгресс сша нэнси пелось повертывать сторона тайвань,4,"Самолет, на котором предположительно находится спикер Палаты представителей Конгресса США Нэнси Пелоси, повернул в сторону Тайваня"
100,делегация нэнси пелось забронировать сорок восемь номер отель grand hyatt тайбэй сообщать тайваньский телеканал саньли данные телеканал прибывать тайвань около местный время москва делегация планировать останавливаться отель ночь,4,"Делегация Нэнси Пелоси забронировала 48 номеров в отеле Grand Hyatt в Тайбэе, сообщил тайваньский телеканал ""Саньли""По данным телеканала, она прибудет на Тайвань около 21:20 по местному времени (16:20 по Москве). Делегация планирует остановиться в отеле на одну ночь."
101,триста тысяча человек наблюдать полет борт позывные spar предположительно находиться спикер палата представитель конгресс сша нэнси пелось,1,"Почти 300 тысяч человек наблюдают за полетом борта с позывным SPAR19, на котором предположительно находится спикер Палаты представителей Конгресса США Нэнси Пелоси"
102,правительственный самолет сша прибывать малайзия американский военновоздушный база скотт иллинойс мочь использовать сопровождение полет спикер палата представитель сша нэнси пелосить тайвань замена спецборт писать газета global times,4,"Еще один правительственный самолет США прибыл в Малайзию с американской военно-воздушной базы Скотт в Иллинойсе и может быть использован для сопровождения полета спикера палаты представителей США Нэнси Пелоси на Тайвань или для замены ее спецборта, пишет газета Global Times."
103,народный освободительный армия китай стягивать бронетехника пляж провинция фуцзяньэто близкий тайвань провинция,2,Народно-освободительная армия Китая стягивает бронетехнику на пляжи провинции ФуцзяньЭто ближайшая к Тайваню провинция.
104,сша переходить рамка дозволять китай лишать сепаратист пособник малый шанс независимость тайвань мид кнр,2,"США переходят рамки дозволенного, Китай лишит сепаратистов и их пособников малейших шансов на независимость Тайваня — МИД КНР"
105,самолет нэнси пелосить борт вылетать малазийский куал лумпурасогласно озвучивать ранее информация визит малайзия пелось планировать посещать тайвань вместе пять член палата представитель демократический партия сша самый дело самолет пелось борт взять курс тайвань вылет пока непонятно,4,"Самолет с Нэнси Пелоси на борту вылетел из малазийского Куала-ЛумпураСогласно озвученной ранее информации, после визита в Малайзию Пелоси планирует посетить Тайвань вместе с 5 членами палаты представителей от Демократической партии США.На самом ли деле самолет с Пелоси на борту взял курс на Тайвань после вылета, пока непонятно."
106,соединять штат убивать главный лидер алькаида айман аз завахири кабул афганистан,1,"Соединенные Штаты убили главного лидера ""Аль-Каиды"" Аймана аз-Завахири в Кабуле, Афганистан"
107,российский нападать клуб национальный хоккейный лига миннесота кирилл каприз находиться сша сообщать портал the athletic ссылка источник нхл июль the athletic сообщать капризывать отказывать въезд сша предположительно отсутствие рабочий виза итог форвард вернуться россия шесть июль телегр канал shot сообщать каприз разыскиваться дело покупка военный билет поздно отец хоккеист олег каприз заявлять тасс сын военный билет иметь отсрочка прохождение служба,5,"Российский нападающий клуба Национальной хоккейной лиги ""Миннесота"" Кирилл Капризов находится в США, сообщает портал The Athletic со ссылкой на источники в НХЛ9 июля The Athletic сообщил, что Капризову было отказано во въезде в США предположительно из-за отсутствия рабочей визы. В итоге форвард вернулся в Россию. 6 июля телеграм-канал SHOT сообщил, что Капризов разыскивается по делу о покупке военного билета. Позднее отец хоккеиста Олег Капризов заявил ТАСС, что у его сына не было военного билета, так как он имеет отсрочку от прохождения службы."
108,первый случай смерть человек оспа обезьяна зафиксировать перо,1,Первый случай смерти человека от оспы обезьян зафиксирован в Перу
109,швейцария принимать й пакет санкция против россия включая эмбарго золото,0,"Швейцария приняла 7-й пакет санкций против России, включая эмбарго на золото"
110,число пострадать пожар склад ozon вырастать одиннадцать человек двое госпитализировать сообщать гу мчс отмечаться тушение привлекать группировка сто человек,8,"Число пострадавших при пожаре на складе Ozon выросло до 11 человек, двое госпитализированы, сообщили в ГУ МЧС.Отмечается, что к тушению привлечена группировка из почти 100 человек."
111,пожар склад озон происходить несоблюдение техника безопасность глава округ истра,8,"Пожар на складе ""Озона"" произошел из-за несоблюдения техники безопасности — глава округа Истра"
112,масштаб пожар склад ozon подмосковьепо предварительный данные пожар начинаться короткий замыкание сварочный работа результат загораться стеллаж,8,"Масштаб пожара на складе Ozon в ПодмосковьеПо предварительным данным, пожар начался из-за короткого замыкания или сварочных работ, в результате которых загорелись стеллажи."
